{
  "contract_type": "review_receipt_core",
  "contract_version": "1.0",
  "activation_state": "inactive",
  "receipt_schema_version": "1.0",
  "review_id": "review-001",
  "sequence_number": 1,
  "supersedes_review_id": null,
  "supersession_reason": null,
  "repository_full_name": "rezahh107/example",
  "repository_id": 42,
  "pr_number": 7,
  "reviewed_head_sha": "1111111111111111111111111111111111111111",
  "scope_digest": "sha256:aaaaaaaaaaaaaaaaaaaaaaaaaaaaaaaaaaaaaaaaaaaaaaaaaaaaaaaaaaaaaaaa",
  "protocol_version": "v1.11.1",
  "inspector_repository": "rezahh107/PR-Inspector",
  "inspector_repository_id": 1288323264,
  "inspector_commit_sha": "2222222222222222222222222222222222222222",
  "inspection_profile": "minimal",
  "evidence_profile": "compact",
  "execution_urgency": "normal",
  "technical_status": "GREEN_TECHNICALLY_READY",
  "canonical_package_digest": "sha256:bbbbbbbbbbbbbbbbbbbbbbbbbbbbbbbbbbbbbbbbbbbbbbbbbbbbbbbbbbbbbbbb",
  "decision_projection_digest": "sha256:cccccccccccccccccccccccccccccccccccccccccccccccccccccccccccccccc",
  "performed_at": "2026-07-18T12:00:00Z"
}
